CarName,Price,Year,KilometersDriven,Fuel Type,Location
Land Rover Discovery SE 3.0 TD6,36 Lakh,2018,"40,000 km",Diesel,"Defence Colony, New Delhi"
Mercedes-Benz GL-Class 350 CDI Blue Efficiency,22.50 Lakh,2014,"53,000 km",Diesel,"Moti Nagar, New Delhi"
Land Rover Range Rover Velar R-Dynamic S Petrol,80 Lakh,2021,"19,000 km",Petrol,"Rajender Nagar, New Delhi"
Audi Q7 45 TDI Quattro Technology,36.90 Lakh,2016,"72,000 km",Diesel,"Paltra, Gurgaon"
Mercedes-Benz E-Class E350 CDI Avantgrade,33.50 Lakh,2017,"46,000 km",Diesel,"Moti Nagar, New Delhi"
Audi Q5 Technology BSVI,61.50 Lakh,2023,"11,100 km",Petrol,"Paltra, Gurgaon"
Audi Q2 Premium Plus I,26.50 Lakh,2021,"28,125 km",Petrol,"Vikas Puri, New Delhi"
Audi A8 L 3.0 TDI quattro,16.90 Lakh,2011,"1,18,500 km",Diesel,"Paltra, Gurgaon"
Maruti Ciaz 1.4 AT Delta,8.25 Lakh,2019,"82,000 km",Petrol,Noida
Skoda Kodiaq 2.0 TDI Style,19.25 Lakh,2018,"1,19,000 km",Diesel,"Rajouri Garden, New Delhi"
Mercedes-Benz GLC 220d,79 Lakh,2024,"2,000 km",Diesel,"Rajender Nagar, New Delhi"
Hyundai Verna CRDi 1.6 AT SX Plus,10.83 Lakh,2019,"47,085 km",Diesel,"Sector 18, Noida"
Toyota Fortuner 4x2 Manual,12 Lakh,2015,"1,40,000 km",Diesel,"Sector 63, Noida"
Maruti Celerio VXI Optional MT BSIV,4.03 Lakh,2018,"82,093 km",Petrol,"Sector 39, Noida"
Toyota Camry Hybrid 2.5,37.50 Lakh,2020,"36,000 km",Petrol,"Naraina, New Delhi"
Toyota Corolla Altis GL MT,9.50 Lakh,2017,"60,000 km",Petrol,"Sector 63, Noida"
Volkswagen Ameo 1.0 MPI Trendline,5.08 Lakh,2018,"66,903 km",Petrol,"Sector 11, Faridabad"
Toyota Camry 2.5 Hybrid,26.75 Lakh,2018,"32,000 km",Petrol,"Ramesh Nagar, New Delhi"
Mini Cooper One,19.50 Lakh,2015,"36,000 km",Petrol,"Rajender Nagar, New Delhi"
Tata Nexon 1.5 Revotorq XMA,7.47 Lakh,2019,"65,000 km",Diesel,"Sector 63, Noida"
Tata Safari XT Plus BSVI,18.75 Lakh,2022,"18,321 km",Diesel,"Vikas Puri, New Delhi"
Toyota Innova Crysta 2.4 ZX 7 STR AT,20.50 Lakh,2021,"1,06,000 km",Diesel,"Vikas Puri, New Delhi"
Mercedes-Benz E-Class E 350d,39.75 Lakh,2018,"44,000 km",Diesel,"Rajender Nagar, New Delhi"
Mercedes-Benz E-Class E350 Coupe,28.90 Lakh,2013,"86,000 km",Petrol,"Naraina, New Delhi"
BMW X5 xDrive 30d,26.50 Lakh,2016,"72,000 km",Diesel,"Vikas Puri, New Delhi"
Toyota Innova Crysta 2.4 G MT BSIV,11.90 Lakh,2016,"84,000 km",Diesel,"Galleria Dlf-iv, Gurgaon"
Mercedes-Benz GLE 250d,42.50 Lakh,2018,"55,627 km",Diesel,"Sector 21e, Gurgaon"
Audi A6 2.8 FSI,10.75 Lakh,2011,"44,000 km",Petrol,"Vikas Puri, New Delhi"
Audi Q7 45 TDI Quattro Technology,33.90 Lakh,2017,"89,000 km",Diesel,"Jasola, New Delhi"
Mercedes-Benz E-Class E 200 CGI,16.50 Lakh,2013,"64,000 km",Petrol,"Lajpat Nagar, New Delhi"
Kia Seltos GTX Plus Turbo DCT,20 Lakh,2023,"3,200 km",Petrol,"Vikas Puri, New Delhi"
Maruti Celerio VXI,4.97 Lakh,2022,"33,515 km",Petrol,"Sector 11, Faridabad"
Toyota Camry 2.5 G,7.90 Lakh,2014,"1,29,800 km",Petrol,"Sector 43, Gurgaon"
Maruti Ignis 1.2 Delta BSIV,5.75 Lakh,2020,"30,917 km",Petrol,"Sector 18, Noida"
Land Rover Range Rover Sport 3.0 Diesel Autobiography,1.95 Crore,2023,"18,000 km",Diesel,"Rajender Nagar, New Delhi"
Hyundai Verna 1.6 VTVT SX Option,8.25 Lakh,2017,"39,329 km",Petrol,"Vasant Kunj, New Delhi"
Maruti Ignis 1.2 AMT Delta BSIV,5.57 Lakh,2019,"28,461 km",Petrol,"Sector 49, Gurgaon"
Skoda Superb LK 1.8 TSI AT,15 Lakh,2018,"1,15,000 km",Petrol,"Karam Pura, New Delhi"
Land Rover Range Rover Velar R-Dynamic S Petrol MY21,80.50 Lakh,2021,"8,000 km",Petrol,"Naraina, New Delhi"
Maruti Wagon R LXI,5.80 Lakh,2023,"2,187 km",Petrol,"Sector 18, Noida"
Maruti Wagon R LXI CNG,2.85 Lakh,2015,"90,000 km",CNG,Ghaziabad
Mercedes-Benz E-Class Exclusive E 220d,49.50 Lakh,2020,"45,000 km",Diesel,"Lajpat Nagar, New Delhi"
BMW 5 Series 520d Luxury Line,42.49 Lakh,2019,"14,000 km",Diesel,Gurgaon
Mahindra XUV500 W10 2WD,9.18 Lakh,2017,"78,643 km",Diesel,"Pitampura, New Delhi"
Honda WR-V i-VTEC VX,7.80 Lakh,2019,"72,000 km",Petrol,"Preet Vihar, New Delhi"
Tata Safari XZ Plus 6 Str BSVI,20.50 Lakh,2021,"17,000 km",Diesel,"Preet Vihar, New Delhi"
Mercedes-Benz E-Class Expression E 220 d BSIV,36.50 Lakh,2017,"58,980 km",Diesel,"Sector 21e, Gurgaon"
Hyundai Verna SX Opt AT Diesel,13.21 Lakh,2020,"51,000 km",Diesel,"Ashok Vihar, New Delhi"
BMW 5 Series 520d Luxury Line,32.50 Lakh,2017,"40,000 km",Diesel,"Karol Bagh, New Delhi"
Mercedes-Benz CLS-Class 350,23.50 Lakh,2011,"20,000 km",Petrol,"Naraina, New Delhi"
Mercedes-Benz E-Class E 350 d BSIV,43.50 Lakh,2018,"45,000 km",Diesel,Gurgaon
Honda Brio S MT,2.73 Lakh,2013,"68,998 km",Petrol,"Sector 39, Noida"
Hyundai Verna VTVT 1.6 AT SX Option,11.25 Lakh,2019,"32,000 km",Petrol,"Bengali Market, New Delhi"
Renault KWID 1.0 RXT AMT BSVI,5.43 Lakh,2022,"12,028 km",Petrol,"Sector 18, Noida"
Mini 3 DOOR John Cooper Works 2019-2020,31 Lakh,2017,"36,000 km",Petrol,"Rajender Nagar, New Delhi"
Toyota Innova Crysta 2.4 GX 7 STR AT,20.50 Lakh,2022,"62,000 km",Diesel,"Sector 63, Noida"
Hyundai Venue SX Plus Turbo DCT BSIV,9.06 Lakh,2019,"38,530 km",Petrol,"Sector 18, Noida"
Mercedes-Benz C-Class Prime C 220d,33.50 Lakh,2019,"55,000 km",Diesel,Gurgaon
Volvo XC60 Inscription D5,56.90 Lakh,2021,"20,160 km",Diesel,"Sector 21e, Gurgaon"
Kia Seltos GTX Plus DCT,13.44 Lakh,2019,"85,540 km",Petrol,"Indirapuram, Ghaziabad"
Hyundai Creta 1.6 SX,12.21 Lakh,2019,"33,000 km",Petrol,Gurgaon
BMW X5 xDrive 30d M Sport,23.90 Lakh,2016,"1,23,000 km",Diesel,"Jangpura, New Delhi"
BMW X3 xDrive30i M Sport,72 Lakh,2022,"8,000 km",Petrol,"Rajender Nagar, New Delhi"
Toyota Innova Crysta 2.4 VX MT 8S BSIV,15 Lakh,2018,"1,39,656 km",Diesel,"Sector 63, Noida"
Hyundai Verna CRDi 1.6 AT SX Option,9.50 Lakh,2018,"1,20,000 km",Diesel,New Delhi
Ford Ecosport 1.5 DV5 MT Titanium Optional,3.70 Lakh,2014,"49,000 km",Diesel,"Indra Vihar, New Delhi"
Mahindra Scorpio N Z8L 6 Str Diesel AT,24.50 Lakh,2023,"16,000 km",Diesel,"Vikas Puri, New Delhi"
Mercedes-Benz C-Class Progressive C 200,40 Lakh,2020,"40,000 km",Petrol,New Delhi
Kia Seltos HTX IVT,13.90 Lakh,2020,"25,000 km",Petrol,"Defence Colony, New Delhi"
BMW 5 Series 530d M Sport,33.75 Lakh,2017,"51,023 km",Diesel,"Patparganj, New Delhi"
Tata Harrier XTA Plus AT BSVI,18.85 Lakh,2021,"38,000 km",Diesel,"Naraina, New Delhi"
Maruti Baleno 1.2 Zeta,6.20 Lakh,2018,"24,430 km",Petrol,Noida
Maruti Swift Dzire VXI CNG BSVI,5.40 Lakh,2020,"65,200 km",CNG,"Jangpura, New Delhi"
Skoda Rapid 1.0 TSI Ambition AT,8.90 Lakh,2021,"67,205 km",Petrol,"Ramgarh B.o, Gurgaon"
Mercedes-Benz C-Class C 220 CDI Avantgarde,27.50 Lakh,2017,"42,000 km",Diesel,"Rajender Nagar, New Delhi"
Mercedes-Benz AMG A 35 4MATIC BSVI,49.75 Lakh,2022,"21,525 km",Petrol,"Patparganj, New Delhi"
Ford Ecosport 1.5 Petrol Titanium Plus AT BSIV,7.10 Lakh,2017,"48,227 km",Petrol,"Sector 11, Faridabad"
Hyundai Creta E Diesel BSVI,12 Lakh,2021,"50,000 km",Diesel,New Delhi
Toyota Fortuner 2.8 2WD AT BSIV,24.60 Lakh,2017,"86,000 km",Diesel,"Naraina, New Delhi"
Hyundai Venue SX Turbo,8.33 Lakh,2020,"35,852 km",Petrol,Noida
Tata Tiago NRG Petrol,4.45 Lakh,2018,"35,000 km",Petrol,"Pitampura, New Delhi"
Maruti Alto K10 LXI,1.80 Lakh,2012,"1,10,000 km",Petrol,Faridabad
Volvo XC60 B5 Ultimate,67 Lakh,2022,"9,300 km",Petrol,"Rajender Nagar, New Delhi"
Kia Seltos HTE Diesel,9.94 Lakh,2020,"41,316 km",Diesel,"Pitampura, New Delhi"
Hyundai Creta 1.6 VTVT S,6.80 Lakh,2016,"60,000 km",Petrol,"Pitampura, New Delhi"
Toyota Fortuner 2.8 4WD AT BSIV,25 Lakh,2017,"53,954 km",Diesel,Gurgaon
Maruti Brezza Zxi Plus,11.90 Lakh,2022,"16,001 km",Petrol,"Preet Vihar, New Delhi"
Ford Endeavour 2.2 Trend MT 4X4,16 Lakh,2016,"98,000 km",Diesel,"Moti Nagar, New Delhi"
Tata Tiago 1.2 Revotron XZA,4.50 Lakh,2018,"30,000 km",Petrol,Gurgaon
Toyota Corolla Altis G MT,5.49 Lakh,2014,"77,000 km",Petrol,"Mohan Nagar, Ghaziabad"
Maruti Ertiga SHVS ZDI Plus,6.25 Lakh,2016,"72,000 km",Diesel,"Dwarka Sector-6, New Delhi"
Maruti Ignis 1.2 Zeta BSIV,5.54 Lakh,2019,"26,790 km",Petrol,"Sector 39, Noida"
Hyundai i10 Era,1.16 Lakh,2010,"1,20,000 km",Petrol,New Delhi
Hyundai Creta 1.6 SX,9.78 Lakh,2018,"51,707 km",Petrol,Noida
Mercedes-Benz A Class A180 Sport,13 Lakh,2013,"61,000 km",Petrol,"Rajender Nagar, New Delhi"
Hyundai i20 Asta Option 1.4 CRDi,4.75 Lakh,2016,"78,500 km",Diesel,"Vikas Puri, New Delhi"
Mahindra XUV300 W8 Option Dual Tone Diesel BSIV,8.97 Lakh,2019,"48,305 km",Diesel,"Sohna Road, Gurgaon"
Skoda Superb LK 1.8 TSI AT,19.55 Lakh,2018,"50,000 km",Petrol,Ghaziabad
Audi Q3 30 TFSI Premium FWD,23.50 Lakh,2018,"55,000 km",Petrol,"Naraina, New Delhi"
Hyundai Grand i10 Magna,3.74 Lakh,2014,"40,622 km",Petrol,"Raj Nagar Extension S.o, Ghaziabad"
Maruti Ertiga ZXI,4.95 Lakh,2014,"78,500 km",Petrol,"Vikas Puri, New Delhi"
Maruti Ciaz ZXi Plus,5.10 Lakh,2015,"90,000 km",Petrol,New Delhi
Volvo XC40 D4 R-Design,28.90 Lakh,2018,"56,426 km",Diesel,"Sector 21e, Gurgaon"
MG Hector Sharp DCT,13.99 Lakh,2019,"45,000 km",Petrol,"Chittranjan Park, New Delhi"
Maruti Ciaz Alpha AT BSVI,7.05 Lakh,2017,"52,000 km",Petrol,"Vikas Puri, New Delhi"
Honda Amaze V CVT Petrol BSIV,6.75 Lakh,2018,"52,000 km",Petrol,"Defence Colony, New Delhi"
Audi Q3 30 TDI,10.90 Lakh,2016,"1,11,000 km",Diesel,"Preet Vihar, New Delhi"
Maruti Wagon R CNG LXI,2.25 Lakh,2011,"75,000 km",CNG,"Chittranjan Park, New Delhi"
Maruti Swift VXI,5.75 Lakh,2018,"34,000 km",Petrol,"Vikas Puri, New Delhi"
Maruti Wagon R CNG LXI,4.85 Lakh,2019,"77,000 km",CNG,"Chittranjan Park, New Delhi"
Mahindra XUV700 AX7 Diesel AT Luxury Pack,26.50 Lakh,2023,"14,680 km",Diesel,"Vikas Puri, New Delhi"
Maruti Baleno Delta,5.64 Lakh,2019,"49,341 km",Petrol,"Sector 28, Gurgaon"
Audi Q7 Technology 2022-2022,86.90 Lakh,2022,"17,100 km",Petrol,"Paltra, Gurgaon"
Hyundai i20 Sportz 1.2,5.77 Lakh,2017,"53,747 km",Petrol,Noida
Maruti Vitara Brezza ZXI Plus,10.90 Lakh,2022,"30,000 km",Petrol,"Preet Vihar, New Delhi"
Audi A8 L 60 TFSI Quattro,53 Lakh,2016,"25,100 km",Petrol,"Paltra, Gurgaon"
Hyundai Venue SX Turbo,9.08 Lakh,2020,"30,200 km",Petrol,"Sohna Road, Gurgaon"
Audi A8 55 TFSI,99.50 Lakh,2020,"18,500 km",Petrol,"Paltra, Gurgaon"
Mercedes-Benz GLS 350d 4MATIC,52 Lakh,2016,"47,000 km",Diesel,"Rajender Nagar, New Delhi"
Tata Altroz XM plus BSVI,7.45 Lakh,2021,"2,493 km",Petrol,"Sector 18, Noida"
Mercedes-Benz A Class A180 Sport,12 Lakh,2015,"80,000 km",Petrol,Faridabad
Tata Nexon XM S Diesel BSVI,8.50 Lakh,2022,"32,244 km",Diesel,Ghaziabad
Toyota Camry Hybrid 2.5,36.25 Lakh,2020,"75,000 km",Petrol,"Naraina, New Delhi"
Maruti Ritz LXI,1.75 Lakh,2010,"76,000 km",Petrol,"Preet Vihar, New Delhi"
Maruti Swift VXI,2.95 Lakh,2013,"89,949 km",Petrol,Noida
Maruti SX4 S Cross DDiS 200 Sigma,3.50 Lakh,2015,"91,229 km",Diesel,Ghaziabad
Mercedes-Benz S-Class S400,63.75 Lakh,2017,"56,000 km",Petrol,"Naraina, New Delhi"
Mahindra XUV500 W9 AT 1.99,14.75 Lakh,2019,"18,231 km",Diesel,"Vikas Puri, New Delhi"
Honda Amaze S Petrol,3.50 Lakh,2015,"78,876 km",Petrol,Noida
Maruti Celerio VXI,3.75 Lakh,2017,"45,000 km",Petrol,"Pitampura, New Delhi"
Mercedes-Benz S-Class S400,63.75 Lakh,2017,"56,000 km",Petrol,"Naraina, New Delhi"
Maruti Baleno 1.2 CVT Zeta,5.43 Lakh,2018,"1,13,810 km",Petrol,"Indirapuram, Ghaziabad"
MG Hector Sharp DCT,15.75 Lakh,2020,"11,000 km",Petrol,"Shalimar Bagh, New Delhi"
Hyundai Venue SX Turbo,8.87 Lakh,2019,"40,678 km",Petrol,Noida
Mercedes-Benz CLA Urban Sport 200d,26.90 Lakh,2019,"44,860 km",Diesel,"Sector 21e, Gurgaon"
Hyundai Aura S CNG,7.65 Lakh,2021,"53,000 km",CNG,"Preet Vihar, New Delhi"
Honda City i VTEC CVT VX,6.76 Lakh,2016,"87,530 km",Petrol,"Raj Nagar Extension S.o, Ghaziabad"
Toyota Glanza G,7.25 Lakh,2021,"18,000 km",Petrol,"Pitampura, New Delhi"
Toyota Camry 2.5 Hybrid,21.75 Lakh,2017,"45,000 km",Petrol,"Naraina, New Delhi"
Hyundai Grand i10 Magna,3.82 Lakh,2015,"53,772 km",Petrol,"Sector 11, Faridabad"
Hyundai Venue N Line N8 turbo DCT BSVI,13.75 Lakh,2022,"7,000 km",Petrol,"Punjabi Bagh, New Delhi"
Renault Triber RXL BSVI,6.50 Lakh,2022,"2,100 km",Petrol,"Ramesh Nagar, New Delhi"
Audi Q7 Technology 2022-2022,84 Lakh,2022,"8,000 km",Petrol,"Rajender Nagar, New Delhi"
Honda Brio V MT,3.35 Lakh,2014,"78,000 km",Petrol,"Defence Colony, New Delhi"
Toyota Innova Crysta 2.4 GX 7 STR AT,20 Lakh,2020,"10,000 km",Diesel,New Delhi
Kia Seltos HTX G,13.75 Lakh,2021,"26,000 km",Petrol,"Ashok Nagar, New Delhi"
Mercedes-Benz C-Class Progressive C 200,40.75 Lakh,2021,"25,000 km",Petrol,"Naraina, New Delhi"
Maruti Baleno 1.2 CVT Zeta,5.10 Lakh,2018,"75,000 km",Petrol,"Nit, Faridabad"
Ford Endeavour 3.2 Titanium AT 4X4,28.75 Lakh,2018,"23,000 km",Diesel,"Ramesh Nagar, New Delhi"
Maruti Ciaz 1.4 Zeta,7.50 Lakh,2018,"50,000 km",Petrol,"Ramesh Nagar, New Delhi"
BMW X7 xDrive30d DPE Signature,96.75 Lakh,2020,"44,000 km",Diesel,"Naraina, New Delhi"
Maruti Baleno Zeta,6.96 Lakh,2021,"27,114 km",Petrol,Noida
Ford Ecosport 1.5 Petrol Titanium,5.50 Lakh,2017,"50,000 km",Petrol,"Lajpat Nagar, New Delhi"
Maruti Ignis 1.2 Delta BSIV,4.71 Lakh,2019,"67,221 km",Petrol,"Sector 11, Faridabad"
Mahindra XUV700 AX5 7 Str Diesel AT BSVI,23.50 Lakh,2023,"6,000 km",Diesel,"Vikas Puri, New Delhi"
Hyundai Grand i10 1.2 Kappa Sportz Option,4.25 Lakh,2017,"68,123 km",Petrol,"Lajpat Nagar, New Delhi"
Hyundai Grand i10 1.2 Kappa Sportz BSIV,4.80 Lakh,2017,"37,240 km",Petrol,"Indirapuram, Ghaziabad"
Ford Ecosport 1.5 Petrol Titanium,5.90 Lakh,2017,"50,000 km",Petrol,"Lajpat Nagar, New Delhi"
Land Rover Discovery HSE 3.0 Si6,49.50 Lakh,2018,"76,000 km",Petrol,"Naraina, New Delhi"
Maruti Brezza Zxi BSVI,11.81 Lakh,2022,"28,284 km",Petrol,"Sector 49, Gurgaon"
Hyundai Alcazar Signature (O) AT,19.50 Lakh,2022,"20,000 km",Petrol,"Nariana, New Delhi"
Hyundai Creta 1.6 VTVT E Plus,8.75 Lakh,2018,"65,000 km",Petrol,"Vikas Puri, New Delhi"
Jaguar XJ 3.0L Portfolio,32.50 Lakh,2016,"40,000 km",Diesel,"Naraina, New Delhi"
Hyundai Creta SX,12.90 Lakh,2021,"25,001 km",Petrol,"Rohini Sector 25, New Delhi"
Maruti Swift LXI,5.99 Lakh,2020,"37,000 km",Petrol,"Mohan Nagar, Ghaziabad"
Maruti Ciaz 1.4 Delta,7.50 Lakh,2019,"54,002 km",Petrol,"Vikas Puri, New Delhi"
Hyundai Venue S Plus,8.90 Lakh,2021,"29,500 km",Petrol,"Preet Vihar, New Delhi"
MG Hector Sharp CVT,18.75 Lakh,2022,"21,231 km",Petrol,"Vikas Puri, New Delhi"
Honda City 1.5 V MT,2.22 Lakh,2010,"90,000 km",Petrol,Gurgaon
Volvo V40 Cross Country D3,6.75 Lakh,2014,"79,000 km",Diesel,"Lajpat Nagar, New Delhi"
Skoda Rapid 1.5 TDI AT Ambition BSIV,8.75 Lakh,2019,"60,000 km",Diesel,"Naraina, New Delhi"
Honda Brio VX,3.09 Lakh,2014,"83,184 km",Petrol,"Sector 18, Noida"
Honda Mobilio S i-DTEC,3.85 Lakh,2014,"70,000 km",Diesel,"Pitampura, New Delhi"
Maruti Baleno 1.2 Alpha,6.40 Lakh,2018,"36,937 km",Petrol,"Sohna Road, Gurgaon"
Volvo S90 D4 Momentum BSIV,33 Lakh,2018,"76,000 km",Diesel,"Naraina, New Delhi"
Hyundai Verna CRDi 1.6 AT SX Option,8.60 Lakh,2018,"57,000 km",Diesel,"Pitampura, New Delhi"
Nissan Kicks XV D BSIV,7.25 Lakh,2019,"97,055 km",Diesel,Noida
Maruti Swift Dzire AMT VXI,5.50 Lakh,2017,"42,000 km",Petrol,"Pitampura, New Delhi"
Mercedes-Benz S-Class S 500 L,47.50 Lakh,2014,"65,000 km",Petrol,"Naraina, New Delhi"
Hyundai Grand i10 Asta Option,3.97 Lakh,2015,"67,374 km",Petrol,"Indirapuram, Ghaziabad"
Volkswagen CrossPolo 1.2 MPI,4.75 Lakh,2016,"50,000 km",Petrol,"Pitampura, New Delhi"
Kia Seltos GTX Plus DCT,14.99 Lakh,2020,"34,000 km",Petrol,"Chittranjan Park, New Delhi"
Maruti Wagon R LXI CNG,3.40 Lakh,2015,"72,000 km",CNG,"Lajpat Nagar, New Delhi"
Audi A4 35 TDI Premium Plus,31 Lakh,2018,"10,000 km",Diesel,"Naraina, New Delhi"
Audi Q3 35 TDI Quattro Premium Plus,12.95 Lakh,2015,"23,000 km",Diesel,"Karam Pura, New Delhi"
Mitsubishi Outlander 2.4,3.50 Lakh,2011,"1,10,000 km",Petrol,Gurgaon
Ford Endeavour 3.2 Titanium AT 4X4,26.35 Lakh,2018,"70,000 km",Diesel,"Naraina, New Delhi"
Kia Seltos Anniversary Edition,15.50 Lakh,2021,"20,000 km",Petrol,New Delhi
Land Rover Discovery Sport TD4 SE 7S,45.75 Lakh,2020,"34,000 km",Diesel,"Patparganj, New Delhi"
Hyundai Creta 1.6 SX Automatic,9.25 Lakh,2018,"72,000 km",Petrol,"Lajpat Nagar, New Delhi"
Mercedes-Benz E-Class Exclusive E 220d,44.90 Lakh,2020,"34,000 km",Diesel,"Naraina, New Delhi"
Tata Nexon XZ Plus (O) Diesel,9.37 Lakh,2021,"46,501 km",Diesel,"Sector 11, Faridabad"
Mahindra XUV500 AT W10 FWD,9.75 Lakh,2017,"47,000 km",Diesel,"Karam Pura, New Delhi"
Ford Freestyle Titanium Plus,5.70 Lakh,2020,"66,787 km",Petrol,"Sector 18, Noida"
Hyundai Tucson 2.0 Dual VTVT 2WD AT GLS,18.75 Lakh,2018,"22,000 km",Petrol,"Naraina, New Delhi"
Land Rover Defender 2.0 110 HSE,1.38 Crore,2023,"2,100 km",Petrol,"Ashok Vihar, New Delhi"
Hyundai Venue SX Plus Turbo DCT,8.66 Lakh,2019,"65,710 km",Petrol,"Indirapuram, Ghaziabad"
Mercedes-Benz GLS 450 4MATIC BSVI,1.38 Crore,2022,"3,200 km",Petrol,"Ashok Vihar, New Delhi"
Mercedes-Benz GLS 350d 4MATIC,48.50 Lakh,2017,"44,000 km",Diesel,"Naraina, New Delhi"
Hyundai i20 N-Line N8 DCT Dual Tone BSVI,11.35 Lakh,2022,"27,865 km",Petrol,"Sohna Road, Gurgaon"
Audi A6 2.0 TDI Technology,10.50 Lakh,2014,"80,000 km",Diesel,"Karol Bagh, New Delhi"
Mitsubishi Pajero Sport 4X2 AT,9.90 Lakh,2016,"96,000 km",Diesel,"Vikas Puri, New Delhi"
Mercedes-Benz GLC Coupe 300d 4MATIC BSVI,64.90 Lakh,2020,"38,000 km",Diesel,"Naraina, New Delhi"
Maruti Swift Dzire AMT ZDI,6.51 Lakh,2018,"50,000 km",Diesel,"Pitampura, New Delhi"
Toyota Innova Crysta 2.7 ZX AT BSIV,18.50 Lakh,2019,"59,000 km",Petrol,"Vikas Puri, New Delhi"
Hyundai Creta 1.6 CRDi AT SX Plus,7 Lakh,2015,"80,000 km",Diesel,"Karol Bagh, New Delhi"
Audi Q7 45 TDI Quattro Premium Plus,58.75 Lakh,2019,"25,000 km",Diesel,"Naraina, New Delhi"
Honda City ZX MT Diesel,13.75 Lakh,2021,"18,000 km",Diesel,"Vikas Puri, New Delhi"
Hyundai Creta 1.6 SX Option,10.75 Lakh,2018,"3,60,123 km",Petrol,"Vikas Puri, New Delhi"
Toyota Fortuner 2.8 2WD MT,26.75 Lakh,2018,"43,000 km",Diesel,"Vikas Puri, New Delhi"
Mercedes-Benz M-Class ML 350 CDI,17.75 Lakh,2014,"83,000 km",Diesel,"Naraina, New Delhi"
Hyundai Grand i10 Sportz,3.86 Lakh,2014,"70,717 km",Petrol,Noida
Hyundai Elantra SX,6.30 Lakh,2015,"59,000 km",Petrol,"Rajouri Garden, New Delhi"
Hyundai Venue SX Turbo BSIV,9.70 Lakh,2020,"24,972 km",Petrol,"Sector 18, Noida"
Mahindra Thar LX 4-Str Hard Top AT BSVI,16 Lakh,2022,"45,000 km",Petrol,"Naraina, New Delhi"
Land Rover Defender 2.0 110 HSE,1.35 Crore,2023,"2,000 km",Petrol,"Ashok Vihar, New Delhi"
Hyundai Venue SX Plus Turbo DCT,9.32 Lakh,2020,"63,462 km",Petrol,Noida
Skoda Superb Style 1.8 TSI AT,19 Lakh,2018,"34,000 km",Petrol,"Nariana, New Delhi"
BMW X5 xDrive 30d SportX Plus,82.50 Lakh,2022,"18,000 km",Diesel,"Naraina, New Delhi"
Maruti Baleno 1.2 Zeta,4.91 Lakh,2017,"1,11,142 km",Petrol,Noida
Land Rover Discovery Sport Petrol HSE 7S,42.50 Lakh,2019,"65,000 km",Petrol,"Vikas Puri, New Delhi"
Land Rover Range Rover Sport SE,99 Lakh,2019,"54,000 km",Diesel,"Vikas Puri, New Delhi"
BMW X1 sDrive20d xLine,30.75 Lakh,2021,"32,000 km",Diesel,"Naraina, New Delhi"
BMW X5 xDrive 30d M Sport,25.50 Lakh,2015,"55,000 km",Diesel,"Vikas Puri, New Delhi"
Maruti XL6 Zeta,9.75 Lakh,2019,"13,450 km",Petrol,"Preet Vihar, New Delhi"
Hyundai Venue SX Plus Turbo DCT BSIV,9.25 Lakh,2019,"30,000 km",Petrol,"Pitampura, New Delhi"
BMW 6 Series GT 630d M Sport 2018-2021,48.50 Lakh,2019,"32,000 km",Diesel,"Naraina, New Delhi"
Hyundai i20 Asta Option 1.2,4.35 Lakh,2014,"80,000 km",Petrol,"Pitampura, New Delhi"
Tata Tiago XZ Plus CNG BSVI,7.25 Lakh,2022,"30,400 km",CNG,"Sector 12, Gurgaon"
Maruti Ciaz AT ZXi,6.95 Lakh,2017,"82,200 km",Petrol,"Sector 12, Gurgaon"
Mercedes-Benz GLS 350d 4MATIC,47.50 Lakh,2017,"80,000 km",Diesel,"Naraina, New Delhi"
Nissan Micra Active XV,3.59 Lakh,2018,"70,860 km",Petrol,"Ramgarh B.o, Gurgaon"
Honda Brio E MT,3.79 Lakh,2016,"43,000 km",Petrol,"Jasola, New Delhi"
Hyundai Venue SX Plus Turbo DCT,9.34 Lakh,2019,"61,383 km",Petrol,"Sector 28, Gurgaon"
Maruti Ciaz Alpha,7.45 Lakh,2019,"52,000 km",Petrol,Faridabad
Hyundai Venue S Turbo BSIV,7.85 Lakh,2019,"54,500 km",Petrol,"Vikas Puri, New Delhi"
Maruti Ritz VXi,2.11 Lakh,2012,"91,383 km",Petrol,"Sector 18, Noida"
Maruti Ertiga VXi (O) CNG BSVI,11.65 Lakh,2022,"25,000 km",CNG,"Pitampura, New Delhi"
Jeep Grand Cherokee Summit 4X4,34.90 Lakh,2017,"53,000 km",Diesel,"Naraina, New Delhi"
Maruti Baleno 1.2 Alpha,5.85 Lakh,2017,"45,336 km",Petrol,"Sector 28, Gurgaon"
Toyota Yaris J CVT,7.92 Lakh,2018,"33,615 km",Petrol,"Pitampura, New Delhi"
Toyota Yaris J CVT,8.27 Lakh,2019,"28,236 km",Petrol,"Pitampura, New Delhi"
Toyota Fortuner 4X4 Diesel AT BSVI,41.50 Lakh,2021,"15,000 km",Diesel,"Naraina, New Delhi"
Ford Mustang V8,79 Lakh,2016,"10,000 km",Petrol,"Chittranjan Park, New Delhi"
Mitsubishi Outlander Chrome,4.50 Lakh,2012,"1,02,809 km",Petrol,"Vasant Kunj, New Delhi"
Hyundai Creta 1.6 VTVT E Plus,8.75 Lakh,2017,"21,324 km",Petrol,"Vasant Kunj, New Delhi"
BMW 5 Series 530d M Sport,39.85 Lakh,2018,"60,000 km",Diesel,"Naraina, New Delhi"
Maruti Swift VVT VXI,4.25 Lakh,2014,"66,128 km",Petrol,"Vasant Kunj, New Delhi"
Hyundai Verna 1.6 CRDi SX Opt,5.50 Lakh,2015,"36,000 km",Diesel,"Lajpat Nagar, New Delhi"
Mahindra XUV500 W7,9.90 Lakh,2019,"74,000 km",Diesel,"Ashok Vihar, New Delhi"
Maruti Swift LXI Option SP Limited Edition,5.60 Lakh,2020,"35,500 km",Petrol,"Preet Vihar, New Delhi"
Maruti SX4 S Cross Alpha DDiS 200 SH,8.83 Lakh,2019,"41,466 km",Diesel,"Sohna Road, Gurgaon"
Honda Jazz 1.2 S i VTEC,5.45 Lakh,2017,"42,000 km",Petrol,"Sector 12, Gurgaon"
Maruti Baleno 1.2 Alpha,5.24 Lakh,2016,"43,833 km",Petrol,"Raj Nagar Extension S.o, Ghaziabad"
Mercedes-Benz GLC 200,48.50 Lakh,2020,"40,000 km",Petrol,"Naraina, New Delhi"
Maruti Vitara Brezza ZDi Plus,5.50 Lakh,2016,"65,000 km",Diesel,"Karam Pura, New Delhi"
Hyundai Grand i10 1.2 Kappa Asta,5.20 Lakh,2018,"40,427 km",Petrol,"Raj Nagar Extension S.o, Ghaziabad"
Maruti Celerio VXI Optional,4.35 Lakh,2018,"62,000 km",Petrol,"M.b.s. Nagar, New Delhi"
Mahindra XUV700 AX3 Diesel AT BSVI,18.75 Lakh,2022,"47,000 km",Diesel,"Naraina, New Delhi"
Nissan Kicks XV D BSIV,7.96 Lakh,2019,"90,985 km",Diesel,Noida
Mahindra TUV 300 mHAWK100 T8,5.30 Lakh,2017,"1,20,000 km",Diesel,New Delhi
Hyundai Creta 1.6 VTVT AT SX Plus,9.75 Lakh,2017,"55,000 km",Petrol,"Shakarpur, New Delhi"
Maruti Ertiga BSIV VXI AT,7.75 Lakh,2017,"60,000 km",Petrol,"Naraina, New Delhi"
Hyundai Creta 1.6 SX,8.99 Lakh,2017,"21,000 km",Petrol,"Pitampura, New Delhi"
Skoda Rapid 1.6 TDI Ambition Plus,4.50 Lakh,2013,"80,000 km",Diesel,New Delhi
Skoda Rapid 1.6 TDI Ambition Plus,5 Lakh,2013,"80,000 km",Diesel,New Delhi
Maruti Baleno Delta Diesel,5.58 Lakh,2019,"38,000 km",Diesel,"Dwarka Sector-6, New Delhi"
Maruti Swift AMT VVT VXI,6.40 Lakh,2020,"51,000 km",Petrol,"Preet Vihar, New Delhi"
Hyundai Grand i10 Sportz,4.35 Lakh,2016,"82,000 km",Petrol,"Defence Colony, New Delhi"
Honda Jazz V CVT,5.40 Lakh,2015,"76,000 km",Petrol,"Defence Colony, New Delhi"
Volvo XC 90 D5 AT AWD,10.50 Lakh,2015,"95,000 km",Diesel,"Naraina, New Delhi"
Maruti Ciaz 1.4 AT Alpha,7.58 Lakh,2017,"39,866 km",Petrol,"Sector 28, Gurgaon"
MG Hector Sharp DCT,16.50 Lakh,2020,"20,000 km",Petrol,New Delhi
Honda Civic ZX Diesel,16.61 Lakh,2019,"74,961 km",Diesel,"Sector 49, Gurgaon"
Ford Aspire Titanium Diesel,2.95 Lakh,2015,"68,000 km",Diesel,"Laxmi Nagar, New Delhi"
Honda CR-V 2.0L 2WD AT,15.75 Lakh,2016,"55,000 km",Petrol,"Chittaranjan, New Delhi"
Maruti Baleno 1.2 Alpha,6.17 Lakh,2018,"62,429 km",Petrol,"Indirapuram, Ghaziabad"
Renault Captur 1.5 Diesel Platine,6.35 Lakh,2018,"68,000 km",Diesel,"Lajpat Nagar, New Delhi"
Ford Figo 1.2P Titanium MT,3.65 Lakh,2016,"65,000 km",Petrol,"Laxmi Nagar, New Delhi"
Tata Harrier XZ Plus Dual Tone 2020-2022,17.83 Lakh,2021,"34,543 km",Diesel,"Sector 11, Faridabad"
Honda Amaze S Petrol,4.50 Lakh,2017,"52,868 km",Petrol,"Mathura Road, Faridabad"
Nissan Terrano XV D Premium AMT,6.45 Lakh,2016,"62,000 km",Diesel,"Sector 12, Gurgaon"
Renault Lodgy 110PS RxZ 8 Seater,3.45 Lakh,2016,"46,000 km",Diesel,Faridabad
Hyundai Creta 1.6 VTVT S,8.35 Lakh,2017,"49,000 km",Petrol,"Sector 12, Gurgaon"
Maruti Baleno 1.2 Zeta,5.70 Lakh,2017,"66,463 km",Petrol,"Vasant Kunj, New Delhi"
Mahindra XUV500 W5 BSIV,8.50 Lakh,2018,"62,000 km",Diesel,"Sector 12, Gurgaon"
Mercedes-Benz GLE 300d BSVI,95 Lakh,2023,"6,000 km",Diesel,"Naraina, New Delhi"
Hyundai Creta 1.4 EX Diesel,9.21 Lakh,2018,"73,000 km",Diesel,"Preet Vihar, New Delhi"
Toyota Corolla Altis JS MT,8.25 Lakh,2016,"75,000 km",Petrol,"Preet Vihar, New Delhi"
Mahindra XUV500 W9 AT BSIV,11.75 Lakh,2018,"61,243 km",Diesel,"Preet Vihar, New Delhi"
