CarName,Price,Year,KilometersDriven,Fuel Type,Location
BMW X1 xDrive 20d xLine,24.50 Lakh,2019,"51,100 km",Diesel,"Rajender Nagar, New Delhi"
Honda Amaze VX CVT,9.68 Lakh,2023,"8,272 km",Petrol,"Ramgarh B.o, Gurgaon"
Audi Q7 Technology 2022-2022,85.50 Lakh,2022,"14,000 km",Petrol,Gurgaon
Hyundai Grand i10 Nios AMT Asta,8.07 Lakh,2020,"5,192 km",Petrol,"Sector 18, Noida"
Mercedes-Benz C-Class C 200 CGI,6.50 Lakh,2011,"86,000 km",Petrol,"Preet Vihar, New Delhi"
Mercedes-Benz GLS 400d 4MATIC BSVI,1.35 Crore,2023,"6,000 km",Diesel,"Naraina, New Delhi"
Renault KWID 1.0 RXT,3.43 Lakh,2018,"20,930 km",Petrol,"Sector 18, Noida"
Porsche Cayenne Coupe GTS Coupe BSVI,1.68 Crore,2023,"1,500 km",Petrol,"Ashok Vihar, New Delhi"
Hyundai Tucson Signature Diesel AT,32 Lakh,2023,"21,000 km",Diesel,"Vikas Puri, New Delhi"
Hyundai Creta SX Opt IVT BSVI,14.56 Lakh,2020,"29,177 km",Petrol,"Sector 18, Noida"
Mercedes-Benz GLS 400d 4MATIC BSVI,1.23 Crore,2022,"10,000 km",Diesel,"Ashok Vihar, New Delhi"
Maruti Ertiga VXI ABS,5.52 Lakh,2014,"41,431 km",Petrol,"Sector 18, Noida"
Mahindra XUV300 W6 Diesel BSIV,8 Lakh,2020,"80,000 km",Diesel,Noida
Mercedes-Benz GLA 200 BSVI,46 Lakh,2023,"15,200 km",Petrol,"Chanakya Puri, New Delhi"
Mercedes-Benz Maybach S-Class S580 BSVI,2.65 Crore,2023,"4,000 km",Petrol,"Ashok Vihar, New Delhi"
Maruti Jimny Alpha AT,14.75 Lakh,2023,"8,000 km",Petrol,"Preet Vihar, New Delhi"
MG Hector Plus 1.5 Turbo Sharp Pro CVT 7 Str BSVI,23 Lakh,2023,"10,000 km",Petrol,New Delhi
Maruti Ertiga VXI AT,10.49 Lakh,2021,"15,000 km",Petrol,"Chittranjan Park, New Delhi"
Mercedes-Benz E-Class Exclusive E 200 BSVI,67 Lakh,2022,"15,000 km",Petrol,"Ramesh Nagar, New Delhi"
Audi Q8 55 TFSI Quattro BSVI,95 Lakh,2022,"10,000 km",Petrol,"Naraina, New Delhi"
Mercedes-Benz E-Class Exclusive E 220d,49.90 Lakh,2019,"17,600 km",Diesel,"Patel Nagar, New Delhi"
Ford Ecosport 1.5 Diesel Titanium BSIV,7.93 Lakh,2019,"32,917 km",Diesel,"Sector 11, Faridabad"
Kia Seltos GTX Plus Diesel AT,17.75 Lakh,2022,"56,143 km",Diesel,"Vikas Puri, New Delhi"
Honda Amaze S Petrol BSIV,5.51 Lakh,2018,"49,061 km",Petrol,"Sector 18, Noida"
Mercedes-Benz E-Class Exclusive E 220d,49.90 Lakh,2020,"18,500 km",Diesel,"Patel Nagar, New Delhi"
Hyundai Venue S,7.85 Lakh,2021,"58,000 km",Petrol,"Sector 16, Noida"
Maruti Alto 800 VXI BSVI,4.09 Lakh,2021,"17,389 km",Petrol,"Sector 11, Faridabad"
Land Rover Range Rover Sport 2.0 Petrol SE,1.10 Crore,2019,"6,200 km",Petrol,"Naraina, New Delhi"
BMW 5 Series 520d Luxury Line,16.50 Lakh,2015,"94,001 km",Diesel,"Preet Vihar, New Delhi"
Renault KWID 1.0 RXT BSVI,5.24 Lakh,2022,"15,260 km",Petrol,"Sector 18, Noida"
Mahindra Thar LX 4-Str Hard Top AT BSVI,16 Lakh,2022,"26,000 km",Petrol,"Vikas Puri, New Delhi"
Kia Seltos HTX G,11.54 Lakh,2019,"27,579 km",Petrol,"Sector 39, Noida"
Kia Carens Prestige Turbo 2022-2023,10.89 Lakh,2022,"20,000 km",Petrol,New Delhi
Maruti Vitara Brezza VDi,6.25 Lakh,2018,"50,000 km",Diesel,"Ramesh Nagar, New Delhi"
Hyundai Creta 1.4 E Plus CRDi,7.99 Lakh,2017,"40,000 km",Diesel,"Chittranjan Park, New Delhi"
BMW 5 Series 530i M Sport BSVI,60 Lakh,2021,"13,000 km",Petrol,"Naraina, New Delhi"
Nissan Kicks XE D BSIV,6.25 Lakh,2019,"80,000 km",Diesel,Noida
Mahindra Thar LX 4-Str Hard Top AT BSVI,14.50 Lakh,2021,"32,000 km",Petrol,"Chittaranjan, New Delhi"
Maruti Brezza Zxi Plus,12.25 Lakh,2022,"18,000 km",Petrol,"Defence Colony, New Delhi"
Honda Brio S MT,2.10 Lakh,2012,"39,779 km",Petrol,Noida
Mercedes-Benz M-Class ML 350 4Matic,20.50 Lakh,2015,"88,000 km",Diesel,"Moti Nagar, New Delhi"
Maruti Baleno 1.2 CVT Alpha,8.63 Lakh,2020,"27,579 km",Petrol,"Sector 18, Noida"
Mahindra XUV700 AX7 AT Luxury Pack,25.50 Lakh,2022,"12,000 km",Petrol,"Rajouri Garden, New Delhi"
Maruti S-Presso VXI 2019-2022,4.09 Lakh,2019,"54,923 km",Petrol,"Sector 49, Gurgaon"
Audi Q7 45 TDI Quattro Technology,39.95 Lakh,2016,"75,000 km",Diesel,Gurgaon
Hyundai Creta SX IVT BSVI,15.50 Lakh,2021,"37,000 km",Petrol,Noida
Maruti Baleno 1.2 CVT Zeta,6.19 Lakh,2018,"61,157 km",Petrol,"Sector 18, Noida"
Maruti Baleno Delta,6.50 Lakh,2020,"30,000 km",Petrol,"Pitampura, New Delhi"
Jeep Compass 2.0 Sport,10.25 Lakh,2018,"67,000 km",Diesel,"Preet Vihar, New Delhi"
Maruti Ignis 1.2 Zeta BSIV,5.57 Lakh,2019,"51,219 km",Petrol,"Sector 18, Noida"
Volkswagen Virtus GT Plus DSG BSVI,17.49 Lakh,2023,"15,000 km",Petrol,"Chittranjan Park, New Delhi"
Maruti Ertiga BSIV VXI,7.20 Lakh,2016,"43,753 km",Petrol,"Ramgarh B.o, Gurgaon"
Mercedes-Benz GLA Class 200 d Sport,16.50 Lakh,2018,"80,000 km",Diesel,Gurgaon
Hyundai Aura S CNG,8.10 Lakh,2022,"22,000 km",CNG,"Ashok Vihar, New Delhi"
Honda City i VTEC V,5.71 Lakh,2015,"62,400 km",Petrol,"Preet Vihar, New Delhi"
Audi Q5 2.0 TFSI Quattro,5.56 Lakh,2009,"63,000 km",Petrol,"Jangpura, New Delhi"
Hyundai Alcazar Signature Dual Tone AT,18.25 Lakh,2022,"40,000 km",Petrol,Ghaziabad
BMW 5 Series 520d Luxury Line,39.99 Lakh,2019,"35,000 km",Diesel,"Chittranjan Park, New Delhi"
BMW X3 xDrive 20d Luxury Line,43 Lakh,2019,"30,000 km",Diesel,"Nangal Raya, New Delhi"
Toyota Fortuner 2.8 4WD AT,39.78 Lakh,2021,"42,000 km",Diesel,"Karam Pura, New Delhi"
MG Hector Plus Sharp DCT,16.90 Lakh,2021,"59,001 km",Petrol,"Preet Vihar, New Delhi"
Tata Nexon 1.2 Revotron XZ Plus,7.58 Lakh,2019,"41,861 km",Petrol,"Sector 18, Noida"
Honda WR-V i-VTEC S,5.99 Lakh,2018,"35,000 km",Petrol,"Chittranjan Park, New Delhi"
Maruti Swift Dzire VXI,3.38 Lakh,2012,"45,698 km",Petrol,"Raj Nagar Extension S.o, Ghaziabad"
Audi A4 35 TDI Premium Sport,10.90 Lakh,2015,"42,000 km",Diesel,"Preet Vihar, New Delhi"
MG Hector Plus Sharp DCT,17.49 Lakh,2020,"18,000 km",Petrol,"Chittranjan Park, New Delhi"
Maruti Ciaz Delta BSIV,7.35 Lakh,2018,"36,472 km",Petrol,"Ramgarh B.o, Gurgaon"
Audi Q7 Technology,81.50 Lakh,2023,"10,000 km",Petrol,"Paltra, Gurgaon"
Mercedes-Benz C-Class Progressive C 200,39.90 Lakh,2019,"39,000 km",Petrol,"Patel Nagar, New Delhi"
Honda Amaze VX Petrol BSIV,6.10 Lakh,2018,"39,972 km",Petrol,"Ramgarh B.o, Gurgaon"
Mercedes-Benz GLA Class 220 D 4MATIC Activity Edition,22.50 Lakh,2017,"28,000 km",Diesel,"Ashok Vihar, New Delhi"
Maruti Swift Dzire ZXI 1.2,7.32 Lakh,2020,"32,057 km",Petrol,"Sector 18, Noida"
BMW X5 xDrive 30d M Sport,28 Lakh,2016,"90,000 km",Diesel,New Delhi
Toyota Innova Crysta 2.8 ZX AT BSIV,19 Lakh,2019,"42,000 km",Diesel,"Lajpat Nagar, New Delhi"
Hyundai Alcazar Signature (O) AT,19.50 Lakh,2022,"33,690 km",Petrol,"Vikas Puri, New Delhi"
Maruti Wagon R LXI BS IV,1.70 Lakh,2010,"1,32,533 km",Petrol,"Sector 63, Noida"
Toyota Corolla Altis D-4D J,5 Lakh,2014,"1,10,000 km",Diesel,Noida
Maruti Celerio VXI AT,3.86 Lakh,2014,"63,000 km",Petrol,"Sector 16, Noida"
Honda City i VTEC V,5.40 Lakh,2015,"59,000 km",Petrol,"Shakarpur, New Delhi"
Tata Harrier XTA Plus AT BSVI,19.50 Lakh,2022,"12,000 km",Diesel,"Shakarpur, New Delhi"
BMW X5 xDrive 30d xLine,69.90 Lakh,2019,"38,000 km",Diesel,"Patel Nagar, New Delhi"
Hyundai Xcent 1.2 VTVT S,5.18 Lakh,2018,"94,803 km",Petrol,"Chattarpur, New Delhi"
Maruti Ertiga CNG VXI BSIV,8.50 Lakh,2018,"61,000 km",CNG,"Krishna Nagar, New Delhi"
Maruti Baleno 1.2 Zeta,5.83 Lakh,2019,"96,012 km",Petrol,"Sector 18, Noida"
Mercedes-Benz E-Class E 200 CGI,21.50 Lakh,2015,"77,000 km",Petrol,"Patel Nagar, New Delhi"
Maruti Ertiga ZXI (O) CNG BSVI,12.50 Lakh,2022,"18,000 km",CNG,"Bengali Market, New Delhi"
Renault KWID 1.0 RXT Optional,3.37 Lakh,2018,"63,417 km",Petrol,Noida
Mahindra Scorpio S5,13.75 Lakh,2020,"24,000 km",Diesel,"Ashok Vihar, New Delhi"
BMW 5 Series 530i M Sport,50 Lakh,2019,"34,900 km",Petrol,"Vikas Puri, New Delhi"
Maruti Ciaz Alpha BSVI,8.76 Lakh,2020,"40,226 km",Petrol,"Sector 11, Faridabad"
Honda Amaze V CVT Petrol,6.75 Lakh,2018,"24,000 km",Petrol,"Defence Colony, New Delhi"
Skoda Rapid 1.0 TSI Ambition,9.66 Lakh,2021,"13,295 km",Petrol,"Ramgarh B.o, Gurgaon"
Hyundai Venue SX Plus Turbo DCT BSIV,8.40 Lakh,2019,"90,000 km",Petrol,New Delhi
Maruti Ritz VXi (ABS) BS IV,2.10 Lakh,2011,"74,632 km",Petrol,"Pitampura, New Delhi"
Mahindra XUV500 W9,12.75 Lakh,2018,"26,000 km",Diesel,"Bengali Market, New Delhi"
Honda City i-VTEC V,8.75 Lakh,2019,"36,000 km",Petrol,"Chittranjan Park, New Delhi"
Mahindra XUV500 AT W6 1.99 mHawk,8.70 Lakh,2018,"90,000 km",Diesel,Gurgaon
Honda City i VTEC V,6.95 Lakh,2015,"50,158 km",Petrol,"Vasant Kunj, New Delhi"
Honda CR-V 2.4L 4WD AT AVN,9.50 Lakh,2014,"65,000 km",Petrol,"Bengali Market, New Delhi"
Maruti Wagon R VXI,6 Lakh,2021,"15,392 km",Petrol,"Vasant Kunj, New Delhi"
Kia Seltos GTK,13.25 Lakh,2019,"28,580 km",Petrol,"Vikas Puri, New Delhi"
Toyota Etios G,3.92 Lakh,2014,"76,413 km",Petrol,"Ramgarh B.o, Gurgaon"
Honda WR-V i-VTEC VX,7.25 Lakh,2017,"19,000 km",Petrol,"Karol Bagh, New Delhi"
Maruti Baleno Alpha,8.93 Lakh,2022,"10,090 km",Petrol,"Sector 18, Noida"
BMW X7 xDrive 40i M Sport,1.11 Crore,2022,"46,979 km",Petrol,"Sector 21e, Gurgaon"
Mahindra Scorpio 1.99 S6 Plus,8.65 Lakh,2017,"80,000 km",Diesel,"Dilshad Garden, New Delhi"
Hyundai Santro Sportz BSIV,5.05 Lakh,2019,"41,017 km",Petrol,"Sector 49, Gurgaon"
Volvo S60 D4 Momentum BSIV,19.90 Lakh,2018,"40,000 km",Diesel,"Vikas Puri, New Delhi"
Mercedes-Benz E-Class Exclusive E 220 d BSIV,53.49 Lakh,2020,"10,000 km",Diesel,Gurgaon
Hyundai Grand i10 Asta Option,4.92 Lakh,2016,"54,959 km",Petrol,"Sector 18, Noida"
Maruti Ciaz 1.3 Zeta,6.75 Lakh,2017,"39,000 km",Diesel,"Chittranjan Park, New Delhi"
Maruti Alto 800 VXI BSVI,4.12 Lakh,2022,"5,481 km",Petrol,"Sector 18, Noida"
Honda City i VTEC CVT VX,4.95 Lakh,2014,"60,000 km",Petrol,New Delhi
Mahindra XUV500 W5 BSIV,7.50 Lakh,2019,"90,000 km",Diesel,Faridabad
Honda Jazz 1.2 SV i VTEC,4.95 Lakh,2015,"52,000 km",Petrol,"Sector 16, Noida"
Mercedes-Benz CLA 200 CGI Sport,27.75 Lakh,2018,"21,536 km",Petrol,"Patparganj, New Delhi"
Honda City 1.5 V AT Sunroof,3.95 Lakh,2012,"40,000 km",Petrol,New Delhi
Hyundai i20 Asta 1.2,5.25 Lakh,2015,"65,000 km",Petrol,"Pitampura, New Delhi"
Ford Ecosport 1.5 Diesel Titanium,5.99 Lakh,2017,"62,000 km",Diesel,"Chittranjan Park, New Delhi"
Skoda Kodiaq 2.0 TDI Style,25.75 Lakh,2018,"28,000 km",Diesel,"Ashok Vihar, New Delhi"
Maruti Ignis 1.2 Zeta BSIV,4.65 Lakh,2017,"19,500 km",Petrol,Faridabad
Hyundai Grand i10 Nios AMT Sportz,7.04 Lakh,2020,"15,573 km",Petrol,"Sector 18, Noida"
Mercedes-Benz CLA 200 CDI Sport,23.50 Lakh,2018,"25,000 km",Diesel,"Rajouri Garden, New Delhi"
Hyundai Verna 1.6 SX VTVT,4.16 Lakh,2013,"45,636 km",Petrol,"Ramgarh B.o, Gurgaon"
BMW X1 sDrive 20d xLine,25.50 Lakh,2018,"34,000 km",Diesel,"Patel Nagar, New Delhi"
Maruti Swift Dzire VXI,5.75 Lakh,2017,"45,912 km",Petrol,"Vasant Kunj, New Delhi"
Hyundai Grand i10 1.2 Kappa Sportz Option,5.61 Lakh,2018,"17,900 km",Petrol,"Sector 11, Faridabad"
Toyota Etios VXD,4.05 Lakh,2015,"43,700 km",Diesel,Noida
Mercedes-Benz C-Class Progressive C 220d,41.90 Lakh,2021,"38,260 km",Diesel,"Sector 21e, Gurgaon"
Maruti S-Presso VXI Plus 2019-2022,4.41 Lakh,2020,"20,146 km",Petrol,"Sector 18, Noida"
Audi A4 35 TFSi Premium,16.90 Lakh,2015,"78,000 km",Petrol,"Nariana, New Delhi"
Kia Seltos HTX Diesel,12.23 Lakh,2020,"40,754 km",Diesel,"Raj Nagar Extension S.o, Ghaziabad"
Mahindra Thar LX 4-Str Hard Top BSVI,14.65 Lakh,2021,"20,000 km",Petrol,Gurgaon
Hyundai Creta 1.6 VTVT AT SX Plus,11.25 Lakh,2018,"58,693 km",Petrol,"Pitampura, New Delhi"
Hyundai Grand i10 Sportz,3.45 Lakh,2013,"68,000 km",Petrol,"Sector 16, Noida"
Mercedes-Benz E-Class E250 CDI Avantgarde,23.90 Lakh,2017,"35,000 km",Diesel,"Chittranjan Park, New Delhi"
Mahindra Scorpio S7 140 BSIV,10.50 Lakh,2018,"70,000 km",Diesel,New Delhi
Kia Seltos HTX Diesel,12.50 Lakh,2019,"55,000 km",Diesel,"Preet Vihar, New Delhi"
Hyundai Creta 1.6 VTVT E Plus,8.50 Lakh,2017,"58,525 km",Petrol,"Vasant Kunj, New Delhi"
Audi Q3 30 TFSI Premium FWD,22.50 Lakh,2018,"39,000 km",Petrol,"Moti Nagar, New Delhi"
Land Rover Discovery Sport TD4 SE 7S,27.50 Lakh,2017,"93,000 km",Diesel,"Moti Nagar, New Delhi"
Honda BR-V i-VTEC VX MT,6.42 Lakh,2016,"68,685 km",Petrol,"Sector 18, Noida"
Hyundai Creta 1.6 CRDi AT SX Plus,10.90 Lakh,2018,"65,400 km",Diesel,"Sector 12, Gurgaon"
Maruti Baleno 1.2 Delta,4.64 Lakh,2015,"68,675 km",Petrol,"Sector 18, Noida"
Toyota Fortuner 2.7 2WD MT BSIV,25.90 Lakh,2016,"55,000 km",Petrol,Gurgaon
Mahindra XUV500 W7,9.65 Lakh,2018,"72,169 km",Diesel,"Pitampura, New Delhi"
Maruti Baleno 1.2 Delta,5.09 Lakh,2017,"71,475 km",Petrol,"Raj Nagar Extension S.o, Ghaziabad"
BMW X5 xDrive 30d xLine,71.99 Lakh,2019,"37,000 km",Diesel,"Chittranjan Park, New Delhi"
Mercedes-Benz Maybach S-Class S580,2.65 Crore,2023,"4,000 km",Petrol,"Rajender Nagar, New Delhi"
Maruti Ciaz VXi Plus,5.48 Lakh,2015,"44,237 km",Petrol,"Chattarpur, New Delhi"
Land Rover Range Rover Velar P250 R-Dynamic SE,58.75 Lakh,2018,"53,000 km",Petrol,"Patparganj, New Delhi"
Maruti Ciaz ZXi,5.64 Lakh,2015,"48,211 km",Petrol,"Ramgarh B.o, Gurgaon"
Kia Seltos HTK G,9 Lakh,2019,"60,000 km",Petrol,New Delhi
BMW 5 Series 530i Sport Line,40.75 Lakh,2017,"35,000 km",Petrol,"Patparganj, New Delhi"
Audi A3 35 TDI Premium Plus,10.49 Lakh,2015,"45,000 km",Diesel,"Galleria Dlf-iv, Gurgaon"
BMW 3 Series GT Luxury Line,24 Lakh,2018,"68,000 km",Diesel,"Defence Colony, New Delhi"
Maruti Ciaz VDi,3.50 Lakh,2015,"50,000 km",Diesel,Greater Noida
Hyundai Venue SX Turbo,10.90 Lakh,2019,"17,000 km",Petrol,"Defence Colony, New Delhi"
Maruti Ciaz Sigma,6 Lakh,2018,"58,000 km",Petrol,"Pitampura, New Delhi"
Audi A6 Lifestyle Edition,33.90 Lakh,2019,"35,000 km",Petrol,"Lajpat Nagar, New Delhi"
BMW 5 Series 520d Luxury Line,51 Lakh,2020,"10,000 km",Diesel,"Rajender Nagar, New Delhi"
Maruti Baleno 1.2 Alpha,5.55 Lakh,2017,"50,000 km",Petrol,Noida
Honda WR-V i-VTEC VX,6.80 Lakh,2018,"50,000 km",Petrol,"Chittranjan Park, New Delhi"
Maruti Baleno 1.2 Alpha,5.58 Lakh,2016,"45,892 km",Petrol,"Sector 18, Noida"
Mercedes-Benz CLA 200 CGI Sport,26 Lakh,2017,"33,900 km",Petrol,"Vikas Puri, New Delhi"
Toyota Fortuner 2.8 4WD AT,29.50 Lakh,2018,"66,120 km",Diesel,"Ashok Vihar, New Delhi"
Hyundai Venue SX Opt Turbo BSIV,8.75 Lakh,2019,"26,853 km",Petrol,"Sector 39, Noida"
Honda City i DTEC V,4.85 Lakh,2015,"76,328 km",Diesel,"Pitampura, New Delhi"
Toyota Fortuner 2.8 4WD AT,35.90 Lakh,2020,"68,000 km",Diesel,Gurgaon
Honda Amaze VX i-Vtech,5.37 Lakh,2016,"50,466 km",Petrol,"Sector 11, Faridabad"
BMW X1 sDrive 20d xLine,20 Lakh,2017,"53,902 km",Diesel,"Jangpura, New Delhi"
Honda Jazz 1.2 V i VTEC,5.70 Lakh,2017,"32,828 km",Petrol,"Sector 18, Noida"
Tata Harrier XZA Plus Dark Edition AT 2020-2022,18 Lakh,2021,"30,000 km",Diesel,New Delhi
Toyota Fortuner 2.8 2WD AT BSIV,27.50 Lakh,2018,"48,500 km",Diesel,"Ramesh Nagar, New Delhi"
Honda Amaze S i-Vtech,4.35 Lakh,2015,"79,618 km",Petrol,"City, Faridabad"
Maruti Baleno 1.2 Zeta,7.25 Lakh,2021,"67,053 km",Petrol,"Sector 9, Faridabad"
Audi A4 35 TFSi Premium,14 Lakh,2015,"40,000 km",Petrol,New Delhi
Maruti Swift Dzire AMT ZXI Plus,5.99 Lakh,2018,"58,000 km",Petrol,"Dilshad Garden, New Delhi"
Jeep Compass 1.4 Limited,12.95 Lakh,2018,"75,000 km",Petrol,"Sector 16, Noida"
Hyundai Creta SX Opt Diesel AT BSVI,14.90 Lakh,2020,"60,000 km",Diesel,"Chittaranjan, New Delhi"
BMW 6 Series GT 630i M Sport,65 Lakh,2021,"26,000 km",Petrol,"Rajender Nagar, New Delhi"
Maruti Vitara Brezza ZXI Plus AT,10.20 Lakh,2020,"23,710 km",Petrol,"Sector 39, Noida"
Hyundai Verna VTVT 1.6 AT EX,8.49 Lakh,2018,"60,000 km",Petrol,"Chittranjan Park, New Delhi"
Maruti Swift VXI AMT,7.24 Lakh,2021,"35,477 km",Petrol,"Ramgarh B.o, Gurgaon"
BMW X6 Xdrive40i M Sport,88 Lakh,2021,"24,000 km",Petrol,"Rajender Nagar, New Delhi"
Maruti Ertiga BSIV VXI AT,7.75 Lakh,2017,"83,863 km",Petrol,"Vasant Kunj, New Delhi"
Maruti Ignis 1.2 AMT Delta BSIV,4.66 Lakh,2017,"70,859 km",Petrol,"Sector 18, Noida"
Honda City ZX MT,9.20 Lakh,2019,"43,000 km",Petrol,"Karol Bagh, New Delhi"
Land Rover Range Rover Sport HSE,95 Lakh,2019,"42,000 km",Diesel,"Naraina, New Delhi"
Toyota Etios V,2.53 Lakh,2011,"47,131 km",Petrol,"Sector 39, Noida"
Ford Ecosport 1.5 Diesel Titanium,7.99 Lakh,2018,"64,000 km",Diesel,"Chittranjan Park, New Delhi"
Renault Triber RXZ EASY-R AMT BSVI,8.09 Lakh,2021,"13,199 km",Petrol,"Sector 18, Noida"
Mercedes-Benz GLC 220d 4MATIC Style,28 Lakh,2017,"70,000 km",Diesel,New Delhi
Audi A6 35 TFSI Matrix,19.90 Lakh,2016,"42,000 km",Petrol,"Moti Nagar, New Delhi"
Hyundai Creta 1.6 CRDi SX Option,9.75 Lakh,2018,"66,000 km",Diesel,"Nit, Faridabad"
Toyota Etios Liva 1.2 V,5.75 Lakh,2018,"29,000 km",Petrol,"Vasant Kunj, New Delhi"
Mercedes-Benz GLS 400 4MATIC,51 Lakh,2017,"90,000 km",Petrol,Gurgaon
Toyota Innova Crysta 2.7 ZX AT BSIV,17.50 Lakh,2017,"32,000 km",Petrol,"Bengali Market, New Delhi"
Tata Harrier XZ Plus Dark Edition BSVI,17.25 Lakh,2021,"49,000 km",Diesel,"Lajpat Nagar, New Delhi"
Toyota Etios Liva 1.2 G,4.75 Lakh,2016,"40,000 km",Petrol,Noida
Land Rover Range Rover 3.0 Diesel LWB Vogue,1.68 Crore,2019,"58,000 km",Diesel,"Rajender Nagar, New Delhi"
Maruti Baleno 1.2 Zeta,5.14 Lakh,2016,"99,794 km",Petrol,"Sector 18, Noida"
Mercedes-Benz E-Class Expression E 220 d BSIV,34 Lakh,2016,"50,000 km",Diesel,"Ramesh Nagar, New Delhi"
Maruti Alto 800 VXI BSVI,3.97 Lakh,2021,"13,594 km",Petrol,"Sector 11, Faridabad"
BMW 7 Series 730Ld DPE Signature,88 Lakh,2020,"54,100 km",Diesel,"Rajender Nagar, New Delhi"
Ford Ecosport 1.5 Diesel Titanium,7.95 Lakh,2019,"62,000 km",Diesel,"Sector 16, Noida"
Maruti Swift VXI,4.31 Lakh,2016,"68,157 km",Petrol,"Ramgarh B.o, Gurgaon"
Skoda Kodiaq 2.0 TDI Laurin Klement,27 Lakh,2019,"60,000 km",Diesel,"Lajpat Nagar, New Delhi"
Mercedes-Benz G G 350d,2.39 Crore,2021,"41,000 km",Diesel,"Rajender Nagar, New Delhi"
Tata Nexon XZ Plus S 2020-2022,10.15 Lakh,2021,"9,875 km",Petrol,"Sector 11, Faridabad"
Maruti Ertiga VXI CNG,7.90 Lakh,2018,"66,127 km",CNG,"Vasant Kunj, New Delhi"
Honda City i-VTEC CVT ZX,10.01 Lakh,2018,"22,886 km",Petrol,"Sector 18, Noida"
Honda Amaze S i-Vtech,3.50 Lakh,2015,"70,000 km",Petrol,New Delhi
Honda Jazz 1.2 S i VTEC,4.45 Lakh,2016,"68,000 km",Petrol,"Sector 16, Noida"
Maruti Swift Dzire LDi,4.85 Lakh,2017,"80,000 km",Diesel,Faridabad
Toyota Fortuner 2.8 2WD MT BSIV,29.50 Lakh,2018,"45,000 km",Diesel,"Ramesh Nagar, New Delhi"
Toyota Innova Crysta 2.7 VX 7 STR,20 Lakh,2022,"10,000 km",Petrol,New Delhi
Maruti Ciaz VXi Plus,5.75 Lakh,2015,"64,000 km",Petrol,"Sector 16, Noida"
Maruti SX4 ZXI MT BSIV Leather,2.20 Lakh,2010,"80,000 km",Petrol,Faridabad
Honda City i-VTEC V,7.96 Lakh,2018,"76,000 km",Petrol,"Sector 16, Noida"
Mercedes-Benz E-Class Expression E 200 BSIV,49.75 Lakh,2019,"25,000 km",Petrol,Gurgaon
Hyundai i20 Active 1.2 S,6.04 Lakh,2017,"57,201 km",Petrol,"Sector 18, Noida"
Maruti Baleno Zeta Diesel,4.65 Lakh,2016,"65,000 km",Diesel,"Moti Nagar, New Delhi"
Honda BR-V i-VTEC S MT,8.63 Lakh,2017,"21,895 km",Petrol,"Sector 18, Noida"
Lexus RX 450h F-Sport,62 Lakh,2016,"11,000 km",Petrol,"Rajender Nagar, New Delhi"
Honda City 1.5 V MT,2.65 Lakh,2011,"77,946 km",Petrol,"Pitampura, New Delhi"
Honda City i VTEC CVT VX,6.30 Lakh,2014,"61,955 km",Petrol,Noida
Maruti Celerio VXI Optional,5.45 Lakh,2020,"75,134 km",Petrol,"Vasant Kunj, New Delhi"
Mercedes-Benz GLE 400 4MATIC,45.75 Lakh,2017,"56,000 km",Petrol,"Naraina, New Delhi"
Maruti Ciaz Delta BSIV,7.56 Lakh,2019,"22,776 km",Petrol,"Sector 18, Noida"
Ford Endeavour Titanium Plus 4X4,31.99 Lakh,2019,"59,000 km",Diesel,"Chittranjan Park, New Delhi"
Hyundai Venue SX Plus Turbo DCT,9.03 Lakh,2019,"91,934 km",Petrol,Noida
Mercedes-Benz E-Class Exclusive E 220d BSVI,75 Lakh,2022,"50,000 km",Diesel,New Delhi
Audi Q7 40 TFSI Quattro Technology,55.80 Lakh,2018,"31,700 km",Petrol,"Paltra, Gurgaon"
Audi Q3 35 TDI Quattro Premium Plus,11.90 Lakh,2015,"49,000 km",Diesel,"Paltra, Gurgaon"
Audi Q3 35 TDI Quattro Premium,12.50 Lakh,2015,"76,000 km",Diesel,"Vikas Puri, New Delhi"
Maruti XL6 Zeta,9 Lakh,2020,"70,000 km",Petrol,Faridabad
Volvo XC60 D4 Summum,13 Lakh,2014,"1,25,000 km",Diesel,"Chittranjan Park, New Delhi"
Ford Endeavour 3.2 Titanium AT 4X4,25 Lakh,2018,"86,000 km",Diesel,"Ramesh Nagar, New Delhi"
Audi Q3 2.0 TDI Quattro,12.50 Lakh,2015,"73,000 km",Diesel,"Jangpura, New Delhi"
Mercedes-Benz GLE 300d BSVI,82.90 Lakh,2022,"44,658 km",Diesel,"Sector 21e, Gurgaon"
Maruti Brezza Zxi BSVI,11.19 Lakh,2022,"23,928 km",Petrol,"Sector 18, Noida"
Toyota Innova Crysta 2.4 VX MT,18.75 Lakh,2019,"42,320 km",Diesel,"Vikas Puri, New Delhi"
Honda City i-VTEC CVT ZX,8.54 Lakh,2017,"85,507 km",Petrol,"Sector 11, Faridabad"
BMW 3 Series Gran Limousine 320Ld Luxury Line,54 Lakh,2022,"4,500 km",Diesel,"Rajender Nagar, New Delhi"
Mercedes-Benz GLE 250d,34.50 Lakh,2017,"68,000 km",Diesel,"Vikas Puri, New Delhi"
Hyundai i20 1.2 Asta Dual Tone,6.90 Lakh,2018,"68,499 km",Petrol,"Sector 18, Noida"
BMW X4 M Sport X xDrive30d,49.75 Lakh,2020,"41,258 km",Diesel,"Patparganj, New Delhi"
Skoda Kushaq 1.0 TSI Ambition,12.50 Lakh,2022,"42,000 km",Petrol,Noida
Tata Safari XT Plus Dark Edition BSVI,20.27 Lakh,2022,"36,986 km",Diesel,"Ramgarh B.o, Gurgaon"
Mercedes-Benz GLA 45 AMG,18.25 Lakh,2015,"55,000 km",Petrol,"Moti Nagar, New Delhi"
Audi Q5 30 TDI quattro Premium Plus,15 Lakh,2014,"90,000 km",Diesel,"Chittranjan Park, New Delhi"
Mercedes-Benz GLC 220d 4MATIC Sport,36 Lakh,2017,"89,000 km",Diesel,"Moti Nagar, New Delhi"
Hyundai Xcent 1.2 Kappa S,3.95 Lakh,2014,"62,000 km",Petrol,"Sector 16, Noida"
Toyota Fortuner 4x2 AT,12.75 Lakh,2015,"82,000 km",Diesel,"Preet Vihar, New Delhi"
Maruti XL6 Zeta,8.99 Lakh,2020,"57,000 km",Petrol,"Shakarpur, New Delhi"
Mercedes-Benz GLC 300 4MATIC,39 Lakh,2018,"41,000 km",Petrol,"Vikas Puri, New Delhi"
Mercedes-Benz C-Class C 200 CGI,21.50 Lakh,2015,"40,000 km",Petrol,"Lajpat Nagar, New Delhi"
BMW 5 Series 520d Luxury Line,46.75 Lakh,2021,"45,123 km",Diesel,"Patparganj, New Delhi"
Mercedes-Benz S-Class S 450,92 Lakh,2018,"26,000 km",Petrol,"Ramesh Nagar, New Delhi"
Mercedes-Benz GLS 400d 4MATIC,1.39 Crore,2023,150 km,Diesel,"Rajender Nagar, New Delhi"
Maruti Ciaz AT ZXi,6.68 Lakh,2016,"44,525 km",Petrol,Noida
Toyota Innova Crysta 2.4 GX 7 STR AT,19.75 Lakh,2020,"35,012 km",Diesel,"Vikas Puri, New Delhi"
Hyundai Grand i10 1.2 Kappa Asta,5.20 Lakh,2018,"63,307 km",Petrol,Noida
BMW X1 sDrive20d Expedition,19.49 Lakh,2018,"39,000 km",Diesel,"Moti Nagar, New Delhi"
Ford Aspire 1.2 Ti-VCT Titanium,5.15 Lakh,2017,"65,000 km",Petrol,"Sector 16, Noida"
Hyundai Xcent 1.2 VTVT SX,5.07 Lakh,2017,"69,550 km",Petrol,"Sector 18, Noida"
BMW 3 Series 320d Luxury Line,23.25 Lakh,2018,"53,000 km",Diesel,"Sector 12, Gurgaon"
BMW 5 Series 520d Sport Line,29 Lakh,2017,"55,000 km",Diesel,"Moti Nagar, New Delhi"
Maruti Ciaz 1.4 AT Alpha,7.55 Lakh,2017,"60,685 km",Petrol,Noida
Tata Safari XT Plus Dark Edition BSVI,14 Lakh,2021,"62,000 km",Diesel,"Sector 63, Noida"
Mercedes-Benz E-Class 280 Elegance,2.45 Lakh,2006,"90,000 km",Petrol,New Delhi
Mercedes-Benz B Class B180 Sports,13.50 Lakh,2013,"26,000 km",Petrol,"Naraina, New Delhi"
Honda City i-VTEC VX,9.85 Lakh,2019,"26,755 km",Petrol,"Sector 9, Faridabad"
Audi A6 35 TFSI Matrix,21.50 Lakh,2016,"64,000 km",Petrol,"Nariana, New Delhi"
Toyota Fortuner 4x2 AT,14.50 Lakh,2015,"1,12,000 km",Diesel,"Galleria Dlf-iv, Gurgaon"
BMW X1 sDrive 20d xLine,15.50 Lakh,2016,"70,000 km",Diesel,"Naraina, New Delhi"
Skoda Superb LK 1.8 TSI AT,29.50 Lakh,2020,"34,023 km",Petrol,"Vikas Puri, New Delhi"
Toyota Innova Crysta 2.4 ZX MT,14.49 Lakh,2017,"60,000 km",Diesel,"Chittranjan Park, New Delhi"
Ford Endeavour 3.2 Trend AT 4X4,19.15 Lakh,2017,"1,20,000 km",Diesel,"Sector 12, Gurgaon"
Mercedes-Benz C-Class Progressive C 200,42.90 Lakh,2021,"40,426 km",Petrol,"Sector 21e, Gurgaon"
Maruti Ciaz 1.4 Zeta,7.28 Lakh,2017,"16,571 km",Petrol,"Indirapuram, Ghaziabad"
Honda City i VTEC SV,5.25 Lakh,2015,"54,632 km",Petrol,"Pitampura, New Delhi"
Nissan Magnite XV BSVI,7.11 Lakh,2021,"24,643 km",Petrol,"Sector 18, Noida"
Audi Q5 2.0 TDI Premium Plus,11.75 Lakh,2014,"90,000 km",Diesel,"Naraina, New Delhi"
Skoda Octavia 1.8 TSI AT Style,18.25 Lakh,2019,"51,000 km",Petrol,"Nariana, New Delhi"
Honda City i VTEC V,5.93 Lakh,2015,"41,122 km",Petrol,"Sector 18, Noida"
Kia Carnival Limousine,29.50 Lakh,2020,"34,000 km",Diesel,Gurgaon
Volvo XC60 D5 Inscription,51 Lakh,2020,"25,000 km",Diesel,"Rajender Nagar, New Delhi"
Mahindra KUV 100 mFALCON G80 K2 Plus,4.54 Lakh,2018,"28,356 km",Petrol,"Sector 39, Noida"
Mercedes-Benz S-Class S 350 CDI,51.75 Lakh,2018,"52,000 km",Diesel,"Patparganj, New Delhi"
Mercedes-Benz E-Class Exclusive E 200 BSIV,23.50 Lakh,2016,"58,000 km",Petrol,"Vikas Puri, New Delhi"
Volvo XC60 D4 Momentum,38 Lakh,2018,"60,000 km",Diesel,"Rajender Nagar, New Delhi"
Hyundai Venue SX Turbo,9.75 Lakh,2020,"47,000 km",Petrol,"Preet Vihar, New Delhi"
Mini 3 DOOR Cooper S BSVI,43.75 Lakh,2019,"35,125 km",Petrol,"Patparganj, New Delhi"
Jeep Wrangler 3.6 4X4,44.75 Lakh,2019,"26,521 km",Petrol,"Patparganj, New Delhi"
Volvo S60 D4 Momentum BSIV,19.75 Lakh,2018,"57,589 km",Diesel,"Sector 21e, Gurgaon"
Audi A6 35 TDI,16.75 Lakh,2015,"64,235 km",Diesel,"Patparganj, New Delhi"
Tata Safari XZA Plus 6 Str AT Dark Edition BSVI,19.99 Lakh,2021,"29,000 km",Diesel,"Karam Pura, New Delhi"
Audi Q7 45 TDI Quattro Technology,35 Lakh,2016,"57,000 km",Diesel,"Naraina, New Delhi"
Audi Q8 Standard,1.08 Crore,2022,"7,000 km",Petrol,"Rajender Nagar, New Delhi"
Hyundai Creta 1.6 SX Automatic,11.09 Lakh,2019,"32,006 km",Petrol,"Sector 39, Noida"
Toyota Camry Hybrid,16 Lakh,2016,"1,10,000 km",Petrol,New Delhi
Renault KWID RXL,4.66 Lakh,2022,"2,795 km",Petrol,"Sector 18, Noida"
Mercedes-Benz S-Class S 350d,1.48 Crore,2023,"5,000 km",Diesel,"Rajender Nagar, New Delhi"
Jaguar XJ 2.0L Portfolio,65 Lakh,2017,"20,000 km",Petrol,"Chittranjan Park, New Delhi"
Maruti Ignis 1.2 AMT Delta BSIV,5.53 Lakh,2019,"34,824 km",Petrol,"Sector 18, Noida"
Toyota Fortuner 2.8 2WD MT,24.90 Lakh,2018,"81,000 km",Diesel,"Defence Colony, New Delhi"
Kia Seltos HTX IVT,15.65 Lakh,2021,"41,000 km",Petrol,Noida
Maruti Baleno 1.2 Alpha,6.68 Lakh,2019,"25,418 km",Petrol,"Sector 49, Gurgaon"
